{
  "$schema": "https://json-schema.org/draft/2020-12/schema",
  "$id": "https://mnehmos.ai/mathos/schemas/publication/policy/1",
  "title": "MathOS Publication Policy v1",
  "type": "object",
  "additionalProperties": false,
  "required": ["schema_version", "policy_name", "repository", "repository_id", "repository_owner_id", "workflow_path", "required_source_ref", "required_runner_environment", "required_lean_toolchain", "allowed_axioms", "requires_clean_checkout", "requires_dependency_closure", "requires_network_isolation", "requires_memory_limit", "attestation_predicate_type", "attestation_action_sha", "artifact_upload_action_sha", "attestation_verifier_version", "attestation_verifier_archive_sha256", "attestation_verifier_binary_sha256"],
  "properties": {
    "schema_version": {"const": "publication_policy/1"},
    "policy_name": {"type": "string", "minLength": 1, "maxLength": 128},
    "repository": {"const": "Mnehmos/MathOS"},
    "repository_id": {"const": 1305399818},
    "repository_owner_id": {"const": 193347153},
    "workflow_path": {"const": ".github/workflows/publication.yml"},
    "required_source_ref": {"const": "refs/heads/main"},
    "required_runner_environment": {"const": "github_hosted"},
    "required_lean_toolchain": {"pattern": "^leanprover/lean4:v[0-9]+\\.[0-9]+\\.[0-9]+(-[0-9A-Za-z-]+(\\.[0-9A-Za-z-]+)*)?$"},
    "allowed_axioms": {"type": "array", "maxItems": 256, "items": {"type": "string", "minLength": 1, "maxLength": 256}},
    "requires_clean_checkout": {"const": true},
    "requires_dependency_closure": {"const": true},
    "requires_network_isolation": {"const": true},
    "requires_memory_limit": {"const": true},
    "attestation_predicate_type": {"const": "https://slsa.dev/provenance/v1"},
    "attestation_action_sha": {"type": "string", "pattern": "^[0-9a-f]{40}$"},
    "artifact_upload_action_sha": {"type": "string", "pattern": "^[0-9a-f]{40}$"},
    "attestation_verifier_version": {"type": "string", "pattern": "^[0-9]+\\.[0-9]+\\.[0-9]+$"},
    "attestation_verifier_archive_sha256": {"type": "string", "pattern": "^[0-9a-f]{64}$"},
    "attestation_verifier_binary_sha256": {"type": "string", "pattern": "^[0-9a-f]{64}$"}
  }
}
